{
  "$schema": "http://json-schema.org/draft-07/schema#",
  "title": "ItemDefinition",
  "description": "Определение предмета интерьера с его вектором признаков для системы оценки Decorium MVP",
  "type": "object",
  "required": [
    "id",
    "name",
    "category",
    "features"
  ],
  "properties": {
    "id": {
      "type": "string",
      "description": "Уникальный идентификатор предмета",
      "pattern": "^[a-z0-9-]+$"
    },
    "name": {
      "type": "string",
      "description": "Человекочитаемое название"
    },
    "category": {
      "type": "string",
      "enum": ["sofa", "chair", "table", "lighting", "decor", "plant", "rug"],
      "description": "Категория предмета для логики размещения"
    },
    "features": {
      "type": "object",
      "description": "Вектор признаков (Feature Vector) нормализованный [0.0, 1.0]",
      "required": [
        "wood_share",
        "metal_share",
        "glass_share",
        "plastic_share",
        "fabric_share",
        "color_temperature",
        "saturation",
        "form_complexity"
      ],
      "properties": {
        "wood_share": {
          "type": "number",
          "minimum": 0,
          "maximum": 1,
          "description": "Доля дерева в материале"
        },
        "metal_share": {
          "type": "number",
          "minimum": 0,
          "maximum": 1,
          "description": "Доля металла"
        },
        "glass_share": {
          "type": "number",
          "minimum": 0,
          "maximum": 1,
          "description": "Доля стекла"
        },
        "plastic_share": {
          "type": "number",
          "minimum": 0,
          "maximum": 1,
          "description": "Доля пластика"
        },
        "fabric_share": {
          "type": "number",
          "minimum": 0,
          "maximum": 1,
          "description": "Доля ткани"
        },
        "color_temperature": {
          "type": "number",
          "minimum": 0,
          "maximum": 1,
          "description": "0 = холодный (синий/серый), 1 = теплый (желтый/коричневый)"
        },
        "saturation": {
          "type": "number",
          "minimum": 0,
          "maximum": 1,
          "description": "Насыщенность цвета (0 = ахроматический, 1 = яркий)"
        },
        "form_complexity": {
          "type": "number",
          "minimum": 0,
          "maximum": 1,
          "description": "Сложность формы (0 = минимализм/простота, 1 = барокко/декор)"
        }
      },
      "additionalProperties": false
    }
  },
  "additionalProperties": false
}
