[
  {
    "id": "scand-sofa-01",
    "name": "Диван Hygge",
    "category": "sofa",
    "features": {
      "wood_share": 0.7,
      "metal_share": 0.1,
      "glass_share": 0.0,
      "plastic_share": 0.0,
      "fabric_share": 0.9,
      "color_temperature": 0.7,
      "saturation": 0.3,
      "form_complexity": 0.2
    }
  },
  {
    "id": "scand-chair-01",
    "name": "Кресло Nord",
    "category": "chair",
    "features": {
      "wood_share": 0.8,
      "metal_share": 0.0,
      "glass_share": 0.0,
      "plastic_share": 0.0,
      "fabric_share": 0.7,
      "color_temperature": 0.6,
      "saturation": 0.2,
      "form_complexity": 0.15
    }
  },
  {
    "id": "scand-table-01",
    "name": "Журнальный стол Fjord",
    "category": "table",
    "features": {
      "wood_share": 0.9,
      "metal_share": 0.05,
      "glass_share": 0.0,
      "plastic_share": 0.0,
      "fabric_share": 0.0,
      "color_temperature": 0.65,
      "saturation": 0.1,
      "form_complexity": 0.1
    }
  },
  {
    "id": "scand-lamp-01",
    "name": "Торшер Aurora",
    "category": "lighting",
    "features": {
      "wood_share": 0.4,
      "metal_share": 0.5,
      "glass_share": 0.0,
      "plastic_share": 0.0,
      "fabric_share": 0.3,
      "color_temperature": 0.8,
      "saturation": 0.1,
      "form_complexity": 0.2
    }
  },
  {
    "id": "scand-rug-01",
    "name": "Ковер Snow",
    "category": "rug",
    "features": {
      "wood_share": 0.0,
      "metal_share": 0.0,
      "glass_share": 0.0,
      "plastic_share": 0.0,
      "fabric_share": 1.0,
      "color_temperature": 0.9,
      "saturation": 0.05,
      "form_complexity": 0.05
    }
  },
  {
    "id": "scand-plant-01",
    "name": "Фикус Nordic",
    "category": "plant",
    "features": {
      "wood_share": 0.3,
      "metal_share": 0.0,
      "glass_share": 0.0,
      "plastic_share": 0.0,
      "fabric_share": 0.0,
      "color_temperature": 0.4,
      "saturation": 0.6,
      "form_complexity": 0.3
    }
  },
  {
    "id": "scand-decor-01",
    "name": "Ваза Minimal",
    "category": "decor",
    "features": {
      "wood_share": 0.0,
      "metal_share": 0.0,
      "glass_share": 0.8,
      "plastic_share": 0.0,
      "fabric_share": 0.0,
      "color_temperature": 0.3,
      "saturation": 0.1,
      "form_complexity": 0.1
    }
  },
  {
    "id": "scand-shelf-01",
    "name": "Полка Ledge",
    "category": "decor",
    "features": {
      "wood_share": 0.85,
      "metal_share": 0.1,
      "glass_share": 0.0,
      "plastic_share": 0.0,
      "fabric_share": 0.0,
      "color_temperature": 0.6,
      "saturation": 0.1,
      "form_complexity": 0.1
    }
  }
]
